{
  "schema_version": 1,
  "run_id": "full-alfworld-skillopt-eval-rerun",
  "phase": "eval",
  "algo": "skillopt",
  "benchmark": "alfworld",
  "split_manifest": "benchmarks/alfworld/manifests/alfworld_skillopt_id_split.json",
  "split_name": "test",
  "model": "deepseek-v4-flash",
  "harness": {
    "id": "skillopt_claude_code_exec",
    "tools": [
      "Read",
      "Bash"
    ],
    "notes": "SkillOpt 官方原生模式，skill.md 作为本地工作区说明文档直接供模型阅读；评测超参两算法同值：workers=4、max_tool_turns=16、单题 600 秒；max_steps=50；出处：workers、max_steps 抄 configs/alfworld/default.yaml；单局 600 秒与每 step 16 轮为打榜沿用值，官方未定这两项；官方 workers=8，本机 4 核封顶到 4，两算法同样封顶"
  },
  "skill_sha256": "96900449ecd2294d337d34423cf9c4746a199db90901a5010a42e0d03a4a32c4",
  "scorer": {
    "id": "alfworld.env_won",
    "metric": "hard",
    "notes": "规定步数内环境返回 won 算通过。"
  },
  "code": {
    "xskill_commit": "c7be0976f30f4011d660250f5e0ef35a314c34f1"
  },
  "workers": 4,
  "timeout_s": 600.0,
  "max_tool_turns": 16,
  "retry": {
    "request_retries": 3,
    "case_retries": 1
  },
  "seed": 42,
  "failure_policy": "timeout 标记为超时状态，计算准确率时与 fail 同样计为未通过（计入分母，不计入分子）"
}
